{
  "ci_requirements": {
    "fail_on_invalid_examples": true,
    "fail_on_missing_examples": true,
    "fail_on_unexpected_files": true
  },
  "description": "example",
  "input": {
    "docs_root": "example",
    "schema_root": "example",
    "validation_settings": "example"
  },
  "output": {
    "newline_at_end_of_file": true,
    "overwrite_existing": true,
    "pretty_print": true,
    "root": "example",
    "structure": "example"
  },
  "rules": {
    "authority": {
      "docs_are_reference_only": true,
      "schemas_are_source_of_truth": true
    },
    "generation": {
      "allow_additional_properties": true,
      "deterministic_output": true,
      "example_types": [
        "minimal"
      ],
      "examples_per_schema": "comprehensive",
      "field_ordering": "canonical",
      "naming_convention": "kebab-case"
    },
    "validation": {
      "reject_invalid_examples": true,
      "strict_schema_validation": true,
      "use_vscode_settings": true
    }
  },
  "version": "example"
}
